{
  "$schema": "https://json-schema.org/draft/2020-12/schema",
  "$id": "https://neoorigins.example/schema/origin.schema.json",
  "title": "NeoOrigins Origin",
  "description": "An origin the player can pick. File path: data/<namespace>/origins/origins/<origin>.json.",
  "type": "object",
  "required": ["powers"],
  "properties": {
    "name": {
      "description": "Display name (translation key or literal). Defaults to origins.<namespace>.<origin>.name.",
      "oneOf": [
        { "type": "string" },
        { "type": "object" }
      ]
    },
    "description": {
      "description": "Display description (translation key or literal). Defaults to origins.<namespace>.<origin>.description.",
      "oneOf": [
        { "type": "string" },
        { "type": "object" }
      ]
    },
    "icon": {
      "description": "Item ID shown in the picker card. String form is shorthand for {item: ...}.",
      "oneOf": [
        { "type": "string", "pattern": "^[a-z0-9_.-]+:[a-z0-9_./\\-]+$" },
        { "type": "object", "properties": {
          "item": { "type": "string", "pattern": "^[a-z0-9_.-]+:[a-z0-9_./\\-]+$" }
        }, "required": ["item"], "additionalProperties": false }
      ]
    },
    "impact": {
      "description": "Gameplay impact tier shown in the picker.",
      "oneOf": [
        { "type": "string", "enum": ["none", "low", "medium", "high"] },
        { "type": "integer", "minimum": 0, "maximum": 3 }
      ]
    },
    "order": {
      "description": "Sort order within the layer — lower = earlier.",
      "type": "integer"
    },
    "powers": {
      "description": "Power IDs granted when this origin is chosen. All must resolve to power JSONs under data/<namespace>/origins/powers/.",
      "type": "array",
      "items": { "type": "string", "pattern": "^[a-z0-9_.-]+:[a-z0-9_./\\-]+$" }
    },
    "upgrades": {
      "description": "Advancement-triggered migrations to other origins.",
      "type": "array",
      "items": {
        "type": "object",
        "required": ["advancement", "origin"],
        "properties": {
          "advancement": { "type": "string", "pattern": "^[a-z0-9_.-]+:[a-z0-9_./\\-]+$" },
          "origin": { "type": "string", "pattern": "^[a-z0-9_.-]+:[a-z0-9_./\\-]+$" },
          "announcement": { "type": "string" }
        },
        "additionalProperties": false
      }
    },
    "unchoosable": {
      "description": "If true, not shown in the picker (granted only programmatically).",
      "type": "boolean"
    },
    "hidden": {
      "description": "Origins-format synonym for unchoosable — only honored when the file is detected as Origins-format and translated. NeoOrigins-format files should use unchoosable.",
      "type": "boolean"
    },
    "special": {
      "description": "If true, marks the origin as special (e.g. evolution/upgrade targets) for picker presentation.",
      "type": "boolean"
    },
    "required_mods": {
      "description": "Mod ids that must all be loaded for this origin to load. When any are absent the origin is skipped entirely (never registered or shown).",
      "type": "array",
      "items": { "type": "string" }
    },
    "spawn_location": {
      "description": "Preferred first-spawn / respawn placement filter. dimension / structure / structure_tag combine with AND; biome, biome_tag and biomes combine with OR.",
      "type": "object",
      "properties": {
        "dimension": { "type": "string", "pattern": "^[a-z0-9_.-]+:[a-z0-9_./\\-]+$" },
        "biome": { "type": "string", "pattern": "^[a-z0-9_.-]+:[a-z0-9_./\\-]+$" },
        "biome_tag": { "type": "string", "pattern": "^[a-z0-9_.-]+:[a-z0-9_./\\-]+$" },
        "biomes": {
          "type": "array",
          "items": { "type": "string", "pattern": "^[a-z0-9_.-]+:[a-z0-9_./\\-]+$" }
        },
        "structure": { "type": "string", "pattern": "^[a-z0-9_.-]+:[a-z0-9_./\\-]+$" },
        "structure_tag": { "type": "string", "pattern": "^[a-z0-9_.-]+:[a-z0-9_./\\-]+$" },
        "allow_water_surface": { "type": "boolean", "default": false },
        "allow_ocean_floor": { "type": "boolean", "default": false },
        "min_y": { "type": "integer" },
        "max_y": { "type": "integer" },
        "can_see_sky": { "type": "boolean" }
      },
      "additionalProperties": false
    },
    "tier_powers": {
      "description": "Evolution-tier power overlays. At a given tier, powers in add are granted and powers in remove are revoked. Overlays stack cumulatively (tier 2 includes tier 1's changes).",
      "type": "array",
      "items": {
        "type": "object",
        "required": ["tier"],
        "properties": {
          "tier": { "type": "integer", "minimum": 1 },
          "add": {
            "type": "array",
            "items": { "type": "string", "pattern": "^[a-z0-9_.-]+:[a-z0-9_./\\-]+$" }
          },
          "remove": {
            "type": "array",
            "items": { "type": "string", "pattern": "^[a-z0-9_.-]+:[a-z0-9_./\\-]+$" }
          }
        },
        "additionalProperties": false
      }
    }
  },
  "additionalProperties": false
}
