{
  "name": "origins.neoorigins.inchling.name",
  "description": "origins.neoorigins.inchling.description",
  "icon": "minecraft:poppy",
  "impact": "medium",
  "order": 22,
  "powers": [
    "neoorigins:inchling_size",
    "neoorigins:inchling_wall_climbing",
    "neoorigins:inchling_no_fall_damage",
    "neoorigins:inchling_reduced_health",
    "neoorigins:inchling_speed_boost",
    "neoorigins:inchling_hunger_efficiency"
  ],
  "upgrades": [],
  "tier_powers": [
    {
      "tier": 1,
      "add": [
        "neoorigins:inchling_evolved_hp"
      ],
      "remove": []
    },
    {
      "tier": 2,
      "add": [
        "neoorigins:inchling_ascended_hp",
        "neoorigins:inchling_ascended_speed"
      ],
      "remove": [
        "neoorigins:inchling_evolved_hp"
      ]
    },
    {
      "tier": 3,
      "add": [
        "neoorigins:inchling_apex_hp",
        "neoorigins:inchling_apex_slow_falling"
      ],
      "remove": [
        "neoorigins:inchling_ascended_hp"
      ]
    }
  ]
}
