{
  "name": "origins.neoorigins.tiny.name",
  "description": "origins.neoorigins.tiny.description",
  "icon": "minecraft:poppy",
  "impact": "medium",
  "order": 16,
  "powers": [
    "neoorigins:tiny_size",
    "neoorigins:tiny_wall_climbing",
    "neoorigins:tiny_speed_boost",
    "neoorigins:tiny_no_fall_damage",
    "neoorigins:tiny_item_magnetism",
    "neoorigins:tiny_attack_penalty",
    "neoorigins:tiny_hunger_drain"
  ],
  "upgrades": [],
  "tier_powers": [
    {
      "tier": 1,
      "add": [
        "neoorigins:tiny_evolved_hp"
      ],
      "remove": []
    },
    {
      "tier": 2,
      "add": [
        "neoorigins:tiny_ascended_hp",
        "neoorigins:tiny_ascended_speed"
      ],
      "remove": [
        "neoorigins:tiny_evolved_hp"
      ]
    },
    {
      "tier": 3,
      "add": [
        "neoorigins:tiny_apex_hp",
        "neoorigins:tiny_apex_jump_boost"
      ],
      "remove": [
        "neoorigins:tiny_ascended_hp"
      ]
    }
  ]
}
