{
  "name": "origins.neoorigins.enderian.name",
  "description": "origins.neoorigins.enderian.description",
  "icon": "minecraft:ender_pearl",
  "impact": "low",
  "order": 6,
  "powers": [
    "neoorigins:enderian_coldsweat_cold_resist",
    "neoorigins:enderian_ender_eyes",
    "neoorigins:enderian_projectile_dodge",
    "neoorigins:enderian_water_damage",
    "neoorigins:enderian_teleport",
    "neoorigins:enderian_energy"
  ],
  "upgrades": [],
  "tier_powers": [
    {
      "tier": 1,
      "add": [
        "neoorigins:enderian_evolved_hp"
      ],
      "remove": []
    },
    {
      "tier": 2,
      "add": [
        "neoorigins:enderian_ascended_pearl_immune",
        "neoorigins:enderian_ascended_hp"
      ],
      "remove": [
        "neoorigins:enderian_evolved_hp"
      ]
    },
    {
      "tier": 3,
      "add": [
        "neoorigins:enderian_apex_hp"
      ],
      "remove": [
        "neoorigins:enderian_ascended_hp",
        "neoorigins:enderian_water_damage"
      ]
    }
  ],
  "spawn_location": {
    "dimension": "minecraft:the_end",
    "biomes": [
      "minecraft:end_highlands",
      "minecraft:end_midlands",
      "minecraft:end_barrens",
      "minecraft:small_end_islands"
    ]
  }
}