{
  "name": "origins.neoorigins.shulk.name",
  "description": "origins.neoorigins.shulk.description",
  "icon": "minecraft:shulker_shell",
  "impact": "high",
  "order": 8,
  "powers": [
    "neoorigins:shulk_natural_armor",
    "neoorigins:shulk_slow_movement",
    "neoorigins:shulk_levitation_burst",
    "neoorigins:shulk_shell_retreat",
    "neoorigins:shulk_levitation_immunity"
  ],
  "upgrades": [],
  "tier_powers": [
    {
      "tier": 1,
      "add": [
        "neoorigins:shulk_evolved_hp"
      ],
      "remove": []
    },
    {
      "tier": 2,
      "add": [
        "neoorigins:shulk_ascended_hp",
        "neoorigins:shulk_ascended_armor"
      ],
      "remove": [
        "neoorigins:shulk_evolved_hp"
      ]
    },
    {
      "tier": 3,
      "add": [
        "neoorigins:shulk_apex_hp",
        "neoorigins:shulk_apex_knockback_resistance"
      ],
      "remove": [
        "neoorigins:shulk_ascended_hp"
      ]
    }
  ]
}
