{
  "name": "origins.thfox.fox.name",
  "description": "origins.thfox.fox.description",
  "icon": "minecraft:sweet_berries",
  "impact": "high",
  "order": 50,
  "powers": [
    "thfox:dash_airborne_bonus",
    "thfox:dash_combo_kill",
    "thfox:dash_falling_vuln",
    "thfox:dash_pounce",
    "thfox:fluffy_explosion_vuln",
    "thfox:fluffy_fire_vuln",
    "thfox:fluffy_snow_tracker",
    "thfox:fluffy_wet_slowdown",
    "thfox:fluffy_wet_tracker",
    "thfox:food_berry_bonus",
    "thfox:food_disliked_penalty",
    "thfox:food_regen_bonus",
    "thfox:force_sit",
    "thfox:foxiality_berry_dig",
    "thfox:foxiality_claw_dig",
    "thfox:foxiality_freeze_immune",
    "thfox:foxiality_kill_fox_penalty",
    "thfox:foxiality_night_vision",
    "thfox:foxiality_no_slowdown",
    "thfox:foxiality_predator_suppress",
    "thfox:foxiality_predator_vuln",
    "thfox:foxiality_prey_bonus",
    "thfox:foxiality_scare_mobs",
    "thfox:foxiality_sleep_shade",
    "thfox:foxiality_wakeup_loot",
    "thfox:foxify_afk_tick",
    "thfox:foxify_invisibility",
    "thfox:foxify_invulnerable",
    "thfox:foxify_toggle",
    "thfox:foxify_trigger",
    "thfox:foxify_wake",
    "thfox:foxify_wake_on_hit",
    "thfox:hunger_attack_speed",
    "thfox:hunger_damage_scaling",
    "thfox:hunger_exhaustion",
    "thfox:hunt_damage_bonus",
    "thfox:hunt_glow_targets",
    "thfox:hunt_invisibility",
    "thfox:hunt_prepare_tick",
    "thfox:hunt_sleep_block",
    "thfox:hunt_sneak_timer",
    "thfox:hunt_strike_bonus",
    "thfox:hunt_toggle",
    "thfox:setting_allow_second_pounce",
    "thfox:setting_can_adapt_dimensions",
    "thfox:setting_destroy_terrain",
    "thfox:setting_enable_sleepin_mode",
    "thfox:setting_food_nerfs",
    "thfox:setting_grabby_paws",
    "thfox:setting_heavy_armor_restriction",
    "thfox:setting_mace_nerf",
    "thfox:setting_modifier_mode",
    "thfox:setting_op_ness",
    "thfox:setting_optional_leash",
    "thfox:setting_optional_mute_fallsound",
    "thfox:setting_oxygen_restriction",
    "thfox:setting_passive_nightvision",
    "thfox:setting_pounce_add_reach",
    "thfox:setting_shield_restriction",
    "thfox:shy_fear_dark",
    "thfox:shy_fear_dragon",
    "thfox:shy_fear_end",
    "thfox:shy_fear_low_health",
    "thfox:shy_fear_nether",
    "thfox:shy_fear_predator",
    "thfox:shy_fear_thunder",
    "thfox:shy_fear_warden",
    "thfox:shy_fear_wither",
    "thfox:shy_sleep_block",
    "thfox:shy_weakness",
    "thfox:smol_health",
    "thfox:smol_size",
    "thfox:sound_death",
    "thfox:sound_eat",
    "thfox:sound_emote_ambient",
    "thfox:sound_emote_screech",
    "thfox:sound_emote_sniff",
    "thfox:sound_hurt",
    "thfox:sound_sleep",
    "thfox:storage_bundle",
    "thfox:swift_fall_reduction",
    "thfox:swift_jump_boost",
    "thfox:swift_sprint_speed",
    "thfox:tracker_afk_timer",
    "thfox:tracker_comforted",
    "thfox:tracker_deaths",
    "thfox:tracker_dimension_tick",
    "thfox:tracker_dragon_kills",
    "thfox:tracker_end_time",
    "thfox:tracker_fear_level",
    "thfox:tracker_hunt_hit_counter",
    "thfox:tracker_increment_deaths",
    "thfox:tracker_increment_dragon",
    "thfox:tracker_increment_thunderstruck",
    "thfox:tracker_increment_warden",
    "thfox:tracker_increment_wither",
    "thfox:tracker_nether_time",
    "thfox:tracker_snowness",
    "thfox:tracker_thunderstruck",
    "thfox:tracker_warden_kills",
    "thfox:tracker_wetness",
    "thfox:tracker_wither_kills",
    "thfox:weak_heavy_armor",
    "thfox:weak_shield",
    "thfox:weak_small_lungs"
  ],
  "upgrades": [],
  "tier_powers": []
}
