{
  "name": "origins.neoorigins.frostborn.name",
  "description": "origins.neoorigins.frostborn.description",
  "icon": "minecraft:blue_ice",
  "impact": "medium",
  "order": 24,
  "powers": [
    "neoorigins:frostborn_coldsweat_cold_resist",
    "neoorigins:frostborn_coldsweat_heat_weakness",
    "neoorigins:frostborn_freeze_aura",
    "neoorigins:frostborn_cold_buff",
    "neoorigins:frostborn_fire_weakness",
    "neoorigins:frostborn_ice_walk",
    "neoorigins:frostborn_natural_armor",
    "neoorigins:frostborn_nether_damage",
    "neoorigins:frostborn_freeze_immunity",
    "neoorigins:frostborn_stamina"
  ],
  "upgrades": [],
  "tier_powers": [
    {
      "tier": 1,
      "add": [
        "neoorigins:frostborn_evolved_hp"
      ],
      "remove": []
    },
    {
      "tier": 2,
      "add": [
        "neoorigins:frostborn_ascended_hp",
        "neoorigins:frostborn_ascended_fire_weakness"
      ],
      "remove": [
        "neoorigins:frostborn_evolved_hp",
        "neoorigins:frostborn_fire_weakness"
      ]
    },
    {
      "tier": 3,
      "add": [
        "neoorigins:frostborn_apex_hp"
      ],
      "remove": [
        "neoorigins:frostborn_ascended_hp",
        "neoorigins:frostborn_ascended_fire_weakness"
      ]
    }
  ]
}