{
  "name": "origins.neoorigins.gorgon.name",
  "description": "origins.neoorigins.gorgon.description",
  "icon": "minecraft:stone",
  "impact": "high",
  "order": 33,
  "powers": [
    "neoorigins:gorgon_petrifying_gaze",
    "neoorigins:gorgon_stone_fists",
    "neoorigins:gorgon_granite_hide",
    "neoorigins:gorgon_knockback_resist",
    "neoorigins:gorgon_heavy_frame",
    "neoorigins:gorgon_size",
    "neoorigins:gorgon_hunger_drain"
  ],
  "upgrades": [],
  "tier_powers": [
    {
      "tier": 1,
      "add": [
        "neoorigins:gorgon_evolved_hp"
      ],
      "remove": []
    },
    {
      "tier": 2,
      "add": [
        "neoorigins:gorgon_ascended_hp",
        "neoorigins:gorgon_ascended_armor"
      ],
      "remove": [
        "neoorigins:gorgon_evolved_hp"
      ]
    },
    {
      "tier": 3,
      "add": [
        "neoorigins:gorgon_apex_hp",
        "neoorigins:gorgon_apex_speed"
      ],
      "remove": [
        "neoorigins:gorgon_ascended_hp"
      ]
    }
  ]
}
