{
  "name": "origins.neoorigins.monster_tamer.name",
  "description": "origins.neoorigins.monster_tamer.description",
  "icon": "minecraft:lead",
  "impact": "high",
  "order": 39,
  "powers": [
    "neoorigins:tamer_tame_mob",
    "neoorigins:tamer_command_pack",
    "neoorigins:tamer_horde_regen",
    "neoorigins:tamer_weak_alone",
    "neoorigins:tamer_hunger_drain"
  ],
  "upgrades": [],
  "tier_powers": [
    {
      "tier": 1,
      "add": [
        "neoorigins:monster_tamer_evolved_hp"
      ],
      "remove": []
    },
    {
      "tier": 2,
      "add": [
        "neoorigins:monster_tamer_ascended_hp",
        "neoorigins:monster_tamer_ascended_armor"
      ],
      "remove": [
        "neoorigins:monster_tamer_evolved_hp"
      ]
    },
    {
      "tier": 3,
      "add": [
        "neoorigins:monster_tamer_apex_hp",
        "neoorigins:monster_tamer_apex_speed"
      ],
      "remove": [
        "neoorigins:monster_tamer_ascended_hp"
      ]
    }
  ]
}
