{
  "name": "origins.neoorigins.merling.name",
  "description": "origins.neoorigins.merling.description",
  "icon": "minecraft:cod",
  "impact": "medium",
  "order": 2,
  "powers": [
    "neoorigins:merling_coldsweat_cold_resist",
    "neoorigins:merling_water_breathing",
    "neoorigins:merling_aquatic_speed",
    "neoorigins:aquatic_swim_speed",
    "neoorigins:aquatic_fish_diet",
    "neoorigins:aquatic_fish_diet_bonus",
    "neoorigins:merling_night_vision",
    "neoorigins:merling_land_slowdown",
    "neoorigins:merling_dries_out",
    "neoorigins:aquatic_underwater_mining",
    "neoorigins:aquatic_depth_strider"
  ],
  "upgrades": [],
  "spawn_location": {
    "dimension": "minecraft:overworld",
    "biome_tag": "minecraft:is_ocean",
    "allow_ocean_floor": true
  },
  "tier_powers": [
    {
      "tier": 1,
      "add": [
        "neoorigins:merling_evolved_hp",
        "neoorigins:merling_evolved_swim_speed"
      ],
      "remove": []
    },
    {
      "tier": 2,
      "add": [
        "neoorigins:merling_ascended_hp",
        "neoorigins:merling_ascended_conduit"
      ],
      "remove": [
        "neoorigins:merling_evolved_hp",
        "neoorigins:merling_water_breathing",
        "neoorigins:merling_night_vision"
      ]
    },
    {
      "tier": 3,
      "add": [
        "neoorigins:merling_apex_hp",
        "neoorigins:merling_apex_dolphins_grace"
      ],
      "remove": [
        "neoorigins:merling_ascended_hp"
      ]
    }
  ]
}
